ParkID,Name,Icon,Region,Thumbnail,Text1,Text2,ParkUrl,ParkUrlText,MapUrl,MapUrlText,TourUrl,TourUrlText,Location
Alta_Lake,Alta Lake,campground,North Central Region,https://sites.google.com/site/virtualrangerproject/home/files/AltaLake.jpg,"A 181-acre camping park where the mountainous pine forests meet the desert. Alta Lake is about two miles long and a half mile wide. The park offers good trout fishing during summer months. Lake Chelan, with its many activities, is 30 minutes away.","The Alta Lake area was given to State Parks by the city of Pateros and was established ""Alta Lake State Park"" in 1951. The lake was named ""Alta"" in 1900 by Mr. Heinz, a jeweler from Wilbur, who was mining in the area. Finding the lake without a name, he called it after his daughter, Alta Heinz.",http://parks.state.wa.us//239/Alta-Lake,Park Website,http://parks.state.wa.us//DocumentCenter/Home/View/1837,Park Map,,,"<Point><coordinates>-119.938737,48.027116,0.0</coordinates></Point>"
Anderson_Lake,Anderson Lake,sunny,North Puget Sound Region,https://sites.google.com/site/virtualrangerproject/home/files/AndersonLake.jpg,"Anderson Lake State Park is a remote day use park of cedar, fir and alder forest mixed with freshwater marshes. Surrounded by 410 wooded and wetland acres, the park slopes down to the 70-acre Anderson Lake and abounds with birds and wildlife.","Prior to becoming a state park, Anderson Lake was owned by William F. Anderson, who used the land around it to graze his cattle. Curiously, the lake was not named for him or anyone in his family. William Anderson purchased the property in 1947 from Amanda Anderson, who, though not a relative, shared his last name. Anderson Lake was named for one of her ancestors.",http://parks.state.wa.us//240/Anderson-Lake,Park Website,http://parks.state.wa.us//DocumentCenter/Home/View/1838,Park Map,,,"<Point><coordinates>-122.801709,48.012601,0.0</coordinates></Point>"
Battle_Ground_Lake,Battle Ground Lake,campground,Southwest Region,https://sites.google.com/site/virtualrangerproject/home/files/BattlegroundLake.jpg,"Battle Ground Lake State Park is a camping park with 280 acres of beautiful, forested land in the foothills of the Cascade Mountains. The lake itself is of volcanic origin and is considered to be a smaller version of Crater Lake in Oregon.",This area was named for a battle that settlers at Fort Vancouver expected to happen in 1855 between U.S. Army soldiers and some Klickitat Indians. The battle never occurred.,http://parks.state.wa.us/472/Battle-Ground-Lake,Park Website,http://parks.state.wa.us//DocumentCenter/Home/View/1839,Park Map,,,"<Point><coordinates>-122.495855,45.799395,0.0</coordinates></Point>"
Bay_View,Bay View,campground,North West Region,https://sites.google.com/site/virtualrangerproject/home/files/Bayview.jpg,"Bay View State Park is a 25-acre camping park with 1,285 feet of saltwater shoreline on Padilla Bay. Over 11,000 acres of Padilla Bay are designated as National Estuarine Sanctuary. Breazeale Padilla Bay Interpretive Center is located a half mile north of the park.","Bay View State Park was the home of Pat-Teh-Us, a Noo-Wha-Ah Indian chief and signer of the Point Elliot Treaty. The town was named by William J. Mckenna, who plotted the original townsite in 1884. The original portion of the park was donated to the state in 1925 by the Skagit County Agricultural Association.",http://parks.state.wa.us/473/Bay-View,Park Website,,Park Map,,,"<Point><coordinates>-122.479842,48.487616,0.0</coordinates></Point>"
Beacon_Rock,Beacon Rock,campground,Columbia Gorge Region,https://sites.google.com/site/virtualrangerproject/home/files/BeaconRock.jpg,"Beacon Rock State Park is a 5,100-acre year-round camping park with historic significance dating back hundreds of years. The park includes 9,500 feet of freshwater shoreline on the Columbia River.","""Beacon Rock"" was originally named by Lewis and Clark on their expedition to the Pacific Ocean on October 31, 1805. It was near Beacon Rock that they first measured tidal influences from the ocean on the Columbia River.",http://parks.state.wa.us/474/Beacon-Rock,Park Website,http://parks.state.wa.us/DocumentCenter/Home/View/1840,Park Map,,,"<Point><coordinates>-122.02411,45.627671,0.0</coordinates></Point>"
Belfair,Belfair,campground,South Puget Sound Region,https://sites.google.com/site/virtualrangerproject/home/files/Belfair.jpg,"Belfair State Park is a 65-acre, year-round camping park on 3,720 feet of saltwater shoreline at the southern end of Hood Canal in western Washington. It is noted for its saltwater tide flats, wetlands with wind-blown beach grasses and pleasant areas for beach walking and saltwater swimming.",Long ago the site was a central meeting place for generations of Indians. The Skokomish tribe used the area as a campsite and for gathering shellfish. The area was later used as a log dump before officially becoming a state park in 1952.,http://parks.state.wa.us/475/Belfair,Park Website,http://parks.state.wa.us/DocumentCenter/Home/View/1841,Park Map,,,"<Point><coordinates>-122.877723,47.429339,0.0</coordinates></Point>"
Birch_Bay,Birch Bay,campground,North West Region,https://sites.google.com/site/virtualrangerproject/home/files/BirchBay.jpg,"Birch Bay State Park is a 194-acre camping park with 8,255 feet of saltwater shoreline on Birch Bay and 14,923 feet of freshwater shoreline on Terrell Creek. The park is rich in shellfish resources and offers panoramic views of the Cascade Mountains and Canadian Gulf Islands.","Birch Bay was named by botanist Archibald Menzies for its abundance of black birch trees. Menzies was on the 1792 Vancouver expedition. Archeological evidence indicates that the bay was inhabited by Semiahmoo, Lummi and Nooksack tribes since prehistoric times.",http://parks.state.wa.us/170/Birch-Bay,Park Website,http://parks.state.wa.us/DocumentCenter/Home/View/1842,Park Map,,,"<Point><coordinates>-122.764632,48.903176,0.0</coordinates></Point>"
Blake_Island,Blake Island,campground,Seattle-Tacoma Region,https://sites.google.com/site/virtualrangerproject/home/files/BlakeIsland.jpg,"Blake Island State Park is a 475-acre marine camping park with five miles of saltwater beach shoreline providing magnificent views of the Olympic Mountains and the Seattle skyline. The park is only reachable by tour boat or private boat. Indian-style salmon dinners and demonstrations of Northwest Indian dancing are offered at Tillicum Village, a concession on the island.","Blake Island was an ancestral camping ground of the Suquamish Indian tribe, and legend has it Chief Seattle was born there. It is believed the island was named by naval explorer Captain Charles Wilkes in honor of George Smith Blake, who commanded U.S. Coast Survey vessels from 1837 to 1848.",http://parks.state.wa.us/476/Blake-Island,Park Website,http://parks.state.wa.us/DocumentCenter/Home/View/1843,Park Map,,,"<Point><coordinates>-122.495401,47.537668,0.0</coordinates></Point>"
Blind_Island,Blind Island,campground,San Juan Islands Region,https://sites.google.com/site/virtualrangerproject/home/files/BlindIsland.jpg,"Blind Island is a small, three-acre marine camping park located near the entrance of Blind Bay, Shaw Island. This natural area includes 1,280 feet of saltwater and rocky shoreline, with year-round moorage available. This park is part of the Cascadia Marine Trail. All of the onshore campsites are for the exclusive use of boaters arriving by human- or wind-powered watercraft.","In the early part of the century, a ""squatter"" set up housekeeping to the point of building a small house and storage sheds. His lifestyle was mostly that of a hermit, living off his work as a fisherman and tilling a small garden spot, evidence of which stil remains today.",http://parks.state.wa.us/477/Blind-Island,Park Website,,Park Map,,,"<Point><coordinates>-122.936943,48.585031,0.0</coordinates></Point>"
Bogachiel,Bogachiel,campground,Olympic Peninsula Region,https://sites.google.com/site/virtualrangerproject/home/files/Bogachief.jpg,Bogachiel State Park is a thickly forested 123-acre camping park on the banks of the Bogachiel River. It is remotely located on the northwestern tip of Washington state.,"The park was established in 1931. Due to a lack of funds, State Parks entered into an agreement with the Bogachiel Commercial Club and the Forks Chamber of Commerce to jointly operate and manage the area as a public park. State Parks began staffing the park in 1961.",http://parks.state.wa.us/478/Bogachiel,Park Website,http://parks.state.wa.us/DocumentCenter/Home/View/1844,Park Map,,,"<Point><coordinates>-124.361159,47.894788,0.0</coordinates></Point>"
Bottle_Beach,Bottle Beach,sunny,Pacific Coast Region,https://sites.google.com/site/virtualrangerproject/home/files/BottleBeach.jpg,"Bottle Beach State Park is a 75-acre day-use park with 6,000 feet of shoreline on Grays Harbor. The open tide flats are the park's most significant feature. Mud flats in the area support a rich supply of invertebrates that attract shorebirds as they migrate from Central and South America to their breeding grounds in the Arctic.",Bottle Beach State Park is located on the historic town site of Ocosta.,http://parks.state.wa.us/479/Bottle-Beach,Park Website,,Park Map,,,"<Point><coordinates>-124.041504,46.892829,0.0</coordinates></Point>"
Bridgeport,Bridgeport,campground,North Central Region,https://sites.google.com/site/virtualrangerproject/home/files/Bridgeport.jpg,"Bridgeport State Park is a 748-acre camping park with 7,500 feet of freshwater shoreline on Rufus Woods Lake. Set directly behind Chief Joseph Dam, this lake is actually a segment of the Columbia River. The park provides 18 acres of lawn and some shade in the midst of a desert terrain. ""Haystacks,"" unusual volcanic formations resembling their name, are the park's most striking feature.",The park was created as part of a cooperative agreement between Washington State Parks and the U.S. Army Corps of Engineers. The Corps is involved in park-building because of an operating agreement for dams which requires the corps to rebuild recreation areas.,http://parks.state.wa.us/480/Bridgeport,Park Website,http://parks.state.wa.us/DocumentCenter/Home/View/1845,Park Map,,,"<Point><coordinates>-119.609478,48.013089,0.0</coordinates></Point>"
Bridle_Trails,Bridle Trails,sunny,Seattle-Tacoma Region,https://sites.google.com/site/virtualrangerproject/home/files/BridalTrails.jpg,"Bridle Trails State Park, a 482-acre day-use park, is well-known for its horse trails and equestrian shows. The forested park is on the northeast edge of the Seattle metropolitan area.","The park has been under state ownership since the 1880s. By the 1930s, the area was popular as a place for horseback riding, and a trail system had been developed by community riding enthusiasts. Concerned about protecting the land, citizens petitioned the state legislature to make Bridle Trails a state park.",http://parks.state.wa.us/481/Bridle-Trails,Park Website,,Park Map,,,"<Point><coordinates>-122.184491,47.654996,0.0</coordinates></Point>"
Brooks_Memorial,Brooks Memorial,campground,Southcentral Region,https://sites.google.com/site/virtualrangerproject/home/files/BrooksMemorial.jpg,"Brooks Memorial State Park is a 700-acre, year-round camping park located between the barren hills of the south Yakima Valley and the lodgepole pine forests of the Simcoe Mountains. The park provides a variety of natural environments for visitors to enjoy.","Acquired in six parcels between 1944 and 1957, Brooks Memorial State Park is named for and dedicated to area citizen Nelson B. Brooks, who is credited with establishing an excellent community road system.",http://parks.state.wa.us/482/Brooks-Memorial,Park Website,http://parks.state.wa.us/DocumentCenter/Home/View/1846,Park Map,,,"<Point><coordinates>-120.663879,45.949679,0.0</coordinates></Point>"
Cama_Beach,Cama Beach,campground,North Puget Sound Region,https://sites.google.com/site/virtualrangerproject/home/files/CamaBeach.jpg,"Cama Beach offers visitors a chance to step back in time to a 1930s-era Puget Sound fishing resort complete with waterfront cedar cabins and bungalows. These have been refurbished, with modern conveniences added, and are available for rent year round to individuals and groups.","The area, used for centuries by Native Americans for fishing and hunting, looks out on sweeping views of the Sound, with Whidbey Island and the Olympic Mountains beyond.",http://parks.state.wa.us/483/Cama-Beach,Park Website,http://parks.state.wa.us/DocumentCenter/Home/View/1847,Park Map,,,"<Point><coordinates>-122.513216,48.141754,0.0</coordinates></Point>"
Camano_Island,Camano Island,campground,North Puget Sound Region,https://sites.google.com/site/virtualrangerproject/home/files/CamanoIsland.jpg,"Camano Island State Park is a 134-acre camping park with 6,700 feet of rocky shoreline and beach. The park provides sweeping views of the surrounding mountains and offers opportunities for shellfish harvesting.","After the land was designated for use as a park in 1949, the initial development was accomplished in a single day by nearly 900 volunteers from Stanwood and Camano Island. The park celebrated its 50th birthday in July, 1999.",http://parks.state.wa.us/484/Camano-Island,Park Website,http://parks.state.wa.us/DocumentCenter/Home/View/1848,Park Map,,,"<Point><coordinates>-122.493286,48.125822,0.0</coordinates></Point>"
Camp_Wooten_ELC,Camp Wooten ELC,sunny,,https://sites.google.com/site/virtualrangerproject/home/files/CampWooten.jpg,"Located on the Tucannon River in the Blue Mountains, this center offers hiking on forested and mountain trails, canoeing on Donnie Lake and swimming in an indoor pool.","1930s era dining hall with fully equipped modern kitchen, freezers and walk-in cooler; 17 cabins each sleep 11; three cabins sleep six each; one cabin sleeps four; cedar meeting hall with fireplace; several outdoor shelters; restrooms and showers nearby; ADA access.",http://parks.state.wa.us/368/Camp-Wooten,Park Website,http://parks.state.wa.us/DocumentCenter/Home/View/1849,Park Map,,,"<Point><coordinates>-117.697691,46.238202,0.0</coordinates></Point>"
Cape_Disappointment,Cape Disappointment,campground,Pacific Coast Region,https://sites.google.com/site/virtualrangerproject/home/files/CapeDisappointment.jpg,"Cape Disappointment State Park (formerly Fort Canby State Park) is a 1,882-acre camping park on the Long Beach Peninsula, fronted by the Pacific Ocean. The park offers two miles of ocean beach, two lighthouses, an interpretive center and hiking trails. Visitors enjoy beachcombing and exploring the area's rich natural and cultural history. The nearby coastal towns of Ilwaco and Long Beach feature special events and festivals spring through fall.","The Cape Disappointment Lighthouse was constructed in 1856 to warn seamen of the treacherous river bar known by then as ""the graveyard of the Pacific."" This is the oldest functioning lighthouse on the West Coast.",http://parks.state.wa.us/486/Cape-Disappointment,Park Website,http://parks.state.wa.us/DocumentCenter/Home/View/1850,Park Map,,,"<Point><coordinates>-124.065718,46.285025,0.0</coordinates></Point>"
Centennial_Trail,Centennial Trail,hiker,Northeast Region,https://sites.google.com/site/virtualrangerproject/home/files/CentennialTrail.jpg,"Centennial Trail State Park is a 37 mile paved trail, managed by Riverside State Park. The park consists of a paved trail meandering along the Spokane River and extending from Nine Mile Falls to the Idaho state line.","The trail was dedicated and named the Centennial Trail in 1989, in commemoration of Washington state's 100th birthday that year. The trail contains interpretive signs and 42 historical sites, most of which remain unmarked.",http://parks.state.wa.us/487/Centennial-Trail,Park Website,,Park Map,,,"<Point><coordinates>-117.047785,47.697584,0.0</coordinates></Point>"
Clark_Island,Clark Island,campground,San Juan Islands Region,https://sites.google.com/site/virtualrangerproject/home/files/ClarkIsland.jpg?,"Clark Island is a 55-acre marine camping and moorage park with 11,292 feet of saltwater shoreline on the Strait of Georgia. Beaches are sandy on the west side of the island and smooth pea gravel on the east side.","Members of the 1841 Wilkes Expedition named the island after John Clark, a midshipman killed in Perry's Battle of Lake Erie.",http://parks.state.wa.us/488/Clark-Island,Park Website,,Park Map,,,"<Point><coordinates>-122.763885,48.700333,0.0</coordinates></Point>"
Columbia_Hills,Columbia Hills,campground,Columbia Gorge Region,https://sites.google.com/site/virtualrangerproject/home/files/ColumbiaHills.jpg,"Columbia Hills State Park (which includes the Horsethief Lake area and Dalles Mountain Ranch area) is a 3,338-acre camping park with 7,500 feet of freshwater shoreline on the Columbia River. Horsethief Butte dominates the skyline. It stands over the lake like an ancient castle. The lake itself is about 90 acres in size and is actually an impoundment of the Columbia River. The lake was flooded into existence by the reservoir created by The Dalles Dam.","For centuries, the park was the site of a Native American village. The Lewis and Clark expedition camped at the village and described its wooden houses in one of their journals. The village was flooded by the waters of The Dalles Dam.",http://parks.state.wa.us/489/Columbia-Hills,Park Website,http://www.parks.wa.gov/DocumentCenter/Home/View/1851,Park Map,,,"<Point><coordinates>-121.114003,45.646292,0.0</coordinates></Point>"
Columbia_Plateau_Trail,Columbia Plateau Trail,hiker,Northeast Region,https://sites.google.com/site/virtualrangerproject/home/files/ColumbiaPlateauTrail.jpg,"Columbia Plateau Trail State Park is a 4,109-acre, 130-mile-long rail-bed trail that traces the 1908 original path of the Spokane, Portland and Seattle Railroad. The route is most accessible at Cheney, with other less accessible points along the way. The route is steeped in history, with scenic vistas along the trail.","In the early 1900s, the Spokane, Portland and Seattle Railway Company constructed a rail bed in the area. The company, which never actually connected the line from Portland to Seattle, operated the steam, and later diesel, railway for more than 50 years.",http://parks.state.wa.us/490/Columbia-Plateau-Trail,Park Website,http://www.parks.wa.gov/DocumentCenter/Home/View/1853,Park Map,,,"<Point><coordinates>-117.560198,47.479578,0.0</coordinates></Point>"
Conconully,Conconully,campground,North Central Region,https://sites.google.com/site/virtualrangerproject/home/files/Conconully.jpg,"Conconully State Park is an 81-acre camping park with 5,400 feet of freshwater shoreline in north central Washington. Established as the oldest Bureau of Reclamation irrigation project in this part of the country, the park dates back to 1910. State Parks assumed administration in 1945.","Established as the oldest Bureau of Reclamation irrigation project, the park provided picnic facilities, a baseball field and a school location for the historic silver-mining town of Conconully. Conconully, which was the original county seat of Okanogan County, was washed away by a flood in 1894.",http://parks.state.wa.us/491/Conconully,Park Website,http://parks.state.wa.us/DocumentCenter/Home/View/1855,Park Map,,,"<Point><coordinates>-119.753301,48.556689,0.0</coordinates></Point>"
Crawford,Crawford,sunny,Northeast Region,https://sites.google.com/site/virtualrangerproject/home/files/Crawford.jpg,"Crawford State Park is a 49-acre, forested day-use park featuring Gardner Cave, the third longest limestone cavern in Washington. This tourable cave is filled with stalactites, stalagmites, rimstone pools and flow stone.","Gardner Cave is the third longest limestone cavern in Washington. Its early history is unknown. Contemporary accounts indicate the cave was discovered in the summer of 1903 by Mr. Ed Gardner, who homesteaded a quarter section near the cave.",http://parks.state.wa.us/492/Crawford,Park Website,,Park Map,,,"<Point><coordinates>-117.369597,48.994909,0.0</coordinates></Point>"
Curlew_Lake,Curlew Lake,campground,Northeast Region,https://sites.google.com/site/virtualrangerproject/home/files/CurlewLake.jpg,"Curlew Lake State Park is a 123-acre camping park. It borders an air field, is eight miles from a public fossil dig and is also near an active osprey nest that can be viewed from the park. Curlew is one of the most relaxing campgrounds in the state, offering water-and snow-sport activity as well as natural-history and archeological study in the midst of gorgeous surroundings.",Curlew Lake State Park was a summer camp for some of the Indian tribes of this region.,http://parks.state.wa.us/493/Curlew-Lake,Park Website,http://parks.state.wa.us/DocumentCenter/Home/View/1856,Park Map,,,"<Point><coordinates>-118.66033,48.718837,0.0</coordinates></Point>"
Cutts_Island,Cutts Island,sunny,South Puget Sound Region,https://sites.google.com/site/virtualrangerproject/home/files/CuttsIsland.jpg,"Cutts Island is a two-acre marine park situated on Carr Inlet. During low tide, the island has a very nice sand beach. The island features clay cliffs that allow visitors to walk to the top of the island and enjoy the view. The island is covered with various vegetation, and visitors need to be aware of poison oak.",,http://parks.state.wa.us/494/Cutts-Island,Park Website,http://parks.state.wa.us/DocumentCenter/Home/View/1857,Park Map,,,"<Point><coordinates>-122.687877,47.320704,0.0</coordinates></Point>"
Damon_Point,Damon Point,sunny,,https://sites.google.com/site/virtualrangerproject/home/files/DamonPoint.jpg,"Damon Point, a 61-acre day-use park, is the southeastern tip of the Ocean Shores Peninsula. The park consists of a one-mile-long, half-mile-wide stretch of land jutting out into the sea. Damon Point is a textbook example of accreted land, and is one of the few remaining nesting sites of the snowy plover.","In recent years, severe winter storms along the Pacific Coast, and at Damon Point in particular, have resulted in the erosion and destruction of the park_��s access road, parking area and vault toilet. This unstoppable natural process has affected public access to the area. Due to the variability of future weather, it is unlikely that facilities at Damon Point will be rebuilt.",,Park Website,,Park Map,,,"<Point><coordinates>-124.13121,46.947493,0.0</coordinates></Point>"
Daroga,Daroga,campground,North Central Region,https://sites.google.com/site/virtualrangerproject/home/files/Daroga.jpg,"Daroga State Park is a 90-acre camping park with 1.5 miles of Columbia River shoreline on the elevated edge of the desert ""scablands."" The park features camping activities and water-sport access in a unique and beautiful outdoor environment.","The name ""Daroga"" comes from the first letters in the first names of the three Auvil brothers, Dave, Robert and Grady, who started an orchard/ranch at this site in 1928. The brothers developed a new type of peach on the ranch, catalogued as ""the Daroga Peach."" In 1981, Grady Auvil sold the property to the state of Washington.",http://parks.state.wa.us/495/Daroga,Park Website,http://parks.state.wa.us/DocumentCenter/Home/View/1858,Park Map,,,"<Point><coordinates>-120.201538,47.707588,0.0</coordinates></Point>"
Dash_Point,Dash Point,campground,Seattle-Tacoma Region,https://sites.google.com/site/virtualrangerproject/home/files/DashPoint.jpg,"Dash Point State Park is a 398-acre camping park with 3,301 feet of saltwater shoreline on Puget Sound. The beach provides unobstructed views of the Sound and excellent opportunities for sea-life study.","The Dash Point area has been the subject of three survey expeditions since 1800. In the past, the property was called lson Landing, Fairview Beach and Woodstock Beach. The origin of the name ""Dash Point"" is unclear. In the late 1940s, the McLeod family sold the land to the state of Washington with the understanding the property would be used as a park. The park was dedicated in 1962.",http://parks.state.wa.us/496/Dash-Point,Park Website,http://parks.state.wa.us/DocumentCenter/Home/View/1859,Park Map,,,"<Point><coordinates>-122.405958,47.314111,0.0</coordinates></Point>"
Deception_Pass,Deception Pass,campground,North West Region,https://sites.google.com/site/virtualrangerproject/home/files/DeceptionPass.jpg,"Deception Pass State Park is a 4,134-acre marine and camping park with 77,000 feet of saltwater shoreline, and 33,900 feet of freshwater shoreline on three lakes. Rugged cliffs drop to meet the turbulent waters of Deception Pass. The park is outstanding for breath-taking views, old-growth forests and abundant wildlife.","During his Northwest coastal explorations, Captain George Vancouver became the first European to identify the area near Whidbey Island as a passage, which he named ""Deception Pass."" A 1923 act of Congress designated the property for public recreation purposes. In the 1930s, the Civilian Conservation Corps (CCC) built roads, trails, buildings and bridges to develop the park.",http://parks.state.wa.us/497/Deception-Pass,Park Website,http://parks.state.wa.us/DocumentCenter/Home/View/1861,Park Map,,,"<Point><coordinates>-122.646137,48.393918,0.0</coordinates></Point>"
