ParkID,Name,Icon,Region,Thumbnail,Text1,Text2,ParkUrl,ParkUrlText,MapUrl,MapUrlText,TourUrl,TourUrlText,Location
Dosewallips,Dosewallips,campground,Olympic Peninsula Region,https://sites.google.com/site/virtualrangerproject/home/files/Dosewallips.jpg,"Dosewallips State Park is a 425-acre, year-round camping park with 5,500 feet of saltwater shoreline on Hood Canal and 5,400 feet of freshwater shoreline on either side of the Dosewallips River. The park is unique in that it offers both freshwater and saltwater activities. All camp areas are grassy and located in scenic, rustic settings.","Formerly called ""Dose Meadows,"" the flat fields of this park were old homestead sites prior to their existence as a park. Old rail beds are still in place where logs were hauled from the mountains down to the water prior to being floated to their destinations (ships and mills around Puget Sound).",http://parks.state.wa.us/499/Dosewallips,Park Website,http://parks.state.wa.us/DocumentCenter/Home/View/1862,Park Map,,,"<Point><coordinates>-122.90127,47.689814,0.0</coordinates></Point>"
Doug_Beach,Doug's Beach,sunny,Columbia Gorge Region,https://sites.google.com/site/virtualrangerproject/home/files/DougsBeach.jpg,"Doug's Beach State Park is a 400-acre, undeveloped day-use park on the Columbia River. This is one of the premier windsurfing sites in the Columbia Gorge and is rated for advanced sailors. Parking is along the south side of SR 14. There is a pedestrian walkway behind the vehicle-parking area, fenced from passing trains. Visitors access the beach down a paved path with railroad-crossing arms and signals.","The park acquired its name from a windsurfer who used to frequent the beach when the sport was in its infancy. ""Doug"" still lives in the Gorge and owns a business in Hood River, Oregon.",http://parks.state.wa.us/500/Dougs-Beach,Park Website,http://parks.state.wa.us/DocumentCenter/Home/View/1863,Park Map,,,"<Point><coordinates>-121.234657,45.677042,0.0</coordinates></Point>"
Eagle_Island,Eagle Island,sunny,South Puget Sound Region,https://sites.google.com/site/virtualrangerproject/home/files/EagleIsland.jpg,"Eagle Island is a 10-acre marine park with 2,600 feet of saltwater shoreline. The island sits on Balch Passage between McNeil and Anderson islands in South Puget Sound. Visitors can enjoy picnicking on the beach and watching harbor seals on the shoal at low tide.","The park was named after Harry Eagle, a member of the Wilkes Expedition.",http://parks.state.wa.us/501/Eagle-Island,Park Website,,Park Map,,,"<Point><coordinates>-122.696255,47.18772,0.0</coordinates></Point>"
Federation_Forest,Federation Forest,sunny,Seattle-Tacoma Region,https://sites.google.com/site/virtualrangerproject/home/files/FederationForest.jpg,"Federation Forest State Park is a day-use natural area with 619 acres of old growth evergreens. Located along the White River, the park provides visitors with 12 miles of hiking trail, three interpretive trails, an interpretive center with a gift shop and four picnic areas.","The park was acquired, built and organized through the work of Catherine Montgomery and her affiliation with the Washington State Federation of Women's Clubs. The park was dedicated in 1949 and was acquired in four parcels from 1941 to 1971.",http://parks.state.wa.us/502/Federation-Forest,Park Website,http://parks.state.wa.us/DocumentCenter/Home/View/1864,Park Map,,,"<Point><coordinates>-121.702807,47.154841,0.0</coordinates></Point>"
Fields_Spring,Fields Spring,campground,South East Region,https://sites.google.com/site/virtualrangerproject/home/files/FieldsSpring.jpg,"Fields Spring State Park is a 792-acre forested camping park remotely located in the Blue Mountains of Southeastern Washington. A portion of the park sits at a height of 4,500 feet atop Puffer Butte and offers a spectacular view of three states and the Grande Ronde River.","This volcanically originated park was named after Mr. Fields, an early settler who developed a spring used by himself and neighboring settlers. The park is set along one of the Nez Perce Indian seasonal migration routes.",http://parks.state.wa.us/503/Fields-Spring,Park Website,http://parks.state.wa.us/DocumentCenter/Home/View/1865,Park Map,,,"<Point><coordinates>-117.171992,46.078435,0.0</coordinates></Point>"
Flaming_Geyser,Flaming Geyser,sunny,Seattle-Tacoma Region,https://sites.google.com/site/virtualrangerproject/home/files/FlamingGeyser.jpg,"Flaming Geyser State Park is a 480-acre day-use park with more than three miles of freshwater shoreline on the Green River. The park's most unique feature is its ""geysers"" (methane seeps). Park activities include whitewater rafting and model airplane flying.","Flaming Geyser State Park has existed on this location since the 1920's. Operated as a private park into the 1960's, it fell into bankrupcy. State Parks rescued it from conversion to home development and has operated it as a park ever since.",http://parks.state.wa.us/504/Flaming-Geyser,Park Website,http://parks.state.wa.us/DocumentCenter/Home/View/1866,Park Map,,,"<Point><coordinates>-122.030142,47.277106,0.0</coordinates></Point>"
Fort_Casey,Fort Casey,campground,North West Region,https://sites.google.com/site/virtualrangerproject/home/files/FortCasey.jpg,"Fort Casey State Park is a 467-acre marine camping park with a lighthouse and sweeping views of Admiralty Inlet and the Strait of Juan de Fuca. A coast artillery post features two 10-inch and two 3-inch historic guns on display. The park features 10,810 feet of saltwater shoreline on Puget Sound (Admiralty Inlet), and includes Keystone Spit, a two-mile-plus stretch of land separating Admiralty Inlet and Crocket Lake.",Today the Admiralty Head Lighthouse at Fort Casey serves as a historic landmark and interpretive center. The park was incorporated into Ebey's Landing National Historic Reserve in 1980.,http://parks.state.wa.us/505/Fort-Casey,Park Website,http://parks.state.wa.us/DocumentCenter/Home/View/1867,Park Map,,,"<Point><coordinates>-122.67711,48.158902,0.0</coordinates></Point>"
Fort_Columbia,Fort Columbia,sunny,Pacific Coast Region,https://sites.google.com/site/virtualrangerproject/home/files/FortColumbia.jpg,"Fort Columbia State Park is a 593 acre day-use historical park located at the Chinook Point National Historic Landmark and along 6,400 feet of freshwater shoreline on the Columbia River. Within the park are original U.S. Army Coastal Artillery fort buildings and batteries, active from 1896 to 1947. This area was also home to the Chinook Indian Nation and their famed Chief Comcomly, and explored by Robert Gray and the Lewis and Clark expedition.","For the duration of three wars, Fort Columbia was fully manned and operational. Declared a surplus at the end of World War II, the fort transferred to the custody of the state of Washington in 1950 and was then designated as a state park. Twelve historic wood-frame buildings and four coastal defense batteries still stand on the premises.",http://parks.state.wa.us/506/Fort-Columbia,Park Website,,Park Map,,,"<Point><coordinates>-123.919172,46.252865,0.0</coordinates></Point>"
Fort_Ebey,Fort Ebey,campground,North West Region,https://sites.google.com/site/virtualrangerproject/home/files/FortEbey.jpg,"Fort Ebey State Park, a 645-acre camping park on Whidbey Island, was originally built as a coastal defense fort in World War II. Concrete platforms mark the gun locations. The park has three miles of saltwater shoreline on the Strait of Juan de Fuca, a freshwater lake for fishing, and miles of hiking and biking trails.",The park stands on the site of a World War II gun battery which had two six-inch guns in place during the war. The guns were later removed and scrapped.,http://parks.state.wa.us/507/Fort-Ebey,Park Website,http://parks.state.wa.us/DocumentCenter/Home/View/1868,Park Map,,,"<Point><coordinates>-122.7569,48.22338,0.0</coordinates></Point>"
Fort_Flagler,Fort Flagler,campground,North Puget Sound Region,https://sites.google.com/site/virtualrangerproject/home/files/FortFlagler.jpg,"Fort Flagler State Park is a 784-acre marine camping park surrounded on three sides by 19,100 feet of saltwater shoreline. The park rests on a high bluff overlooking Puget Sound, with views of the Olympic and Cascade Mountains. Many historic buildings remain at this 19th-century-established military fort.","Fort Flagler, along with the heavy batteries of Fort Worden and Fort Casey, once guarded nautical entrance to Puget Sound. The property was purchased as a state park in 1955. Fort Flagler is named after Brigadier General Daniel Webster Flagler.",http://parks.state.wa.us/508/Fort-Flagler,Park Website,http://parks.state.wa.us/DocumentCenter/Home/View/1870,Park Map,,,"<Point><coordinates>-122.693834,48.09788,0.0</coordinates></Point>"
Fort_Okanogan,Fort Okanogan,triangle,,https://sites.google.com/site/virtualrangerproject/home/files/FortOkanogan.jpg,"Fort Okanogan State Park is 45-acre day-use park set on a bluff overlooking the Columbia River. The park has 1,000 feet of ""high"" freshwater shoreline, but no beach accessibility.","David Stuart of the Pacific Fur Company established a colony and named it ""Fort Okanogan"" in 1811. In 1821, the fort was purchased by the Hudson Bay Company. Fort Okanogan Interpretive Center overlooks the site of the original fort. The word ""Okanogan"" is derived from ""Okinakane,"" the name the local Indians used for themselves.",http://www.colvilletribes.com/fort_okanogan_interpretive_center.php,Park Website,,Park Map,,,"<Point><coordinates>-119.677884,48.098389,0.0</coordinates></Point>"
Fort_Simcoe,Fort Simcoe,sunny,Olympic Peninsula Region,https://sites.google.com/site/virtualrangerproject/home/files/FortSimcoe.jpg,"Fort Simcoe State Park is a 200-acre, day-use heritage park in south central Washington on the Yakama Indian Nation Reservation. The park is primarily an interpretive effort, telling the story of mid-19th century army life and providing insights into the lifeways of local Native American culture.","Located in the foothills of the Cascade Mountains in an old oak grove watered by natural springs, Fort Simcoe was an 1850's-era military installation established to keep peace between the settlers and the Indians. Due to its unique historic significance, the park was placed on the National Register of Historic Places in June, 1974. Before the fort era, the site was an Indian campground where many trails crossed.",http://parks.state.wa.us/509/Fort-Simcoe,Park Website,http://parks.state.wa.us/DocumentCenter/Home/View/1871,Park Map,,,"<Point><coordinates>-120.838296,46.34336,0.0</coordinates></Point>"
Fort_Townsend,Fort Townsend,campground,Olympic Peninsula Region,https://sites.google.com/site/virtualrangerproject/home/files/FortTownsend.jpg,"This 367-acre marine camping park features 3,960 feet of saltwater shoreline on Port Townsend Bay. The heavily wooded park has a rich military history dating from pioneer days.","The park occupies more than a third of the original Fort Townsend built in 1856 by the U.S. Army for the protection of settlers. Timbers were hewn and laths cut from local forests. The fort was closed between 1859 and 1874, declared ""unfit"" after an inspection by an army headquarters commander from Columbia. Reopened in 1874, the fort thrived until 1895 when fire destroyed the barracks. The property was used as an enemy-munitions defusing station during World War II. State Parks took custody of the premises in 1953.",http://parks.state.wa.us/510/Fort-Townsend,Park Website,http://parks.state.wa.us/DocumentCenter/Home/View/1872,Park Map,,,"<Point><coordinates>-122.80214,48.078237,0.0</coordinates></Point>"
Fort_Worden,Fort Worden,campground,North Puget Sound Region,https://sites.google.com/site/virtualrangerproject/home/files/FortWorden%20.jpg,Fort Worden State Park and Conference Center is a 434-acre multi-use park with over two miles of saltwater shoreline and a wide variety of services and facilities. The park rests on a high bluff overlooking Puget Sound. Many historic buildings remain at this 19th century military fort.,The Coast Artillery Museum was established to preserve and interpret coast artillery history with special emphasis on the harbor defenses of Puget Sound as they existed and functioned from the late 1800s to the end of World War II.,http://parks.state.wa.us/511/Fort-Worden,Park Website,http://parks.state.wa.us/DocumentCenter/Home/View/1875,Park Map,,,"<Point><coordinates>-122.765286,48.13444,0.0</coordinates></Point>"
Ginkgo_Petrified_Forest,Ginkgo Petrified Forest,campground,North Puget Sound Region,https://sites.google.com/site/virtualrangerproject/home/files/GinkgoPetrifiedForest_Wanapum.jpg,"Ginkgo Petrified Forest State Park is a 7,470-acre park with year-round camping at Wanapum recreational area. The park features 27,000 feet of freshwater shoreline on the Wanapum Reservoir on the Columbia River. Petrified wood was discovered in the region in the early 1930s, which led to creation of the park as a national historic preserve.","The park was set aside as a historic preserve when remains of a fossil forest were unearthed during highway construction in the 1930s. Petrified wood from many different trees are common in the area, but specimens of petrified Ginkgo are rare. Many buildings on the premises owe their origin to the work of the 1930s Civilian Conservation Corps.",http://parks.state.wa.us/288/Ginkgo-Petrified-Forest,Park Website,http://parks.state.wa.us/DocumentCenter/Home/View/1876,Park Map,,,"<Point><coordinates>-119.988257,46.954384,0.0</coordinates></Point>"
Goldendale_Observatory,Goldendale Observatory,sunny,Columbia Gorge Region,https://sites.google.com/site/virtualrangerproject/home/files/GoldendaleObservatory.jpg,"Goldendale Observatory State Park is a five-acre educational facility on a 2,100-foot-high hilltop. The observatory houses one of the nation's largest public telescopes and has attracted sky-watchers since its opening in 1973. The observatory is open to anyone who wants to view the universe.","Goldendale Observatory is the fruition of the dream of four amateur astronomers, M. W. McConnell, O. W. VanderVeldon, John Marshall and Don Connor. These four citizens of Vancouver, Washington began constructing a 24-inch, Cassegrain reflecting telescope for Vancouver's Clark college. They ultimately donated the telescope to the town of Goldendale, which constructed observatory buildings on a hilltop north of Goldendale. Funding for construction was provided by donations, a federal grant and a bank loan.",http://parks.state.wa.us/512/Goldendale-Observatory,Park Website,http://parks.state.wa.us/DocumentCenter/Home/View/1877,Park Map,,,"<Point><coordinates>-120.815336,45.838561,0.0</coordinates></Point>"
Grayland_Beach,Grayland Beach,campground,Pacific Coast Region,https://sites.google.com/site/virtualrangerproject/home/files/GraylandBeach.jpg,"Grayland Beach State Park is a 412-acre, year-round, marine camping park with 7,449 feet of spectacular ocean frontage, just south of the town of Grayland. The park attracts kite flyers, kite-flying observers and those who just like a pleasant day at the beach.","The park was named for Captain Robert Gray, an American sea captain who discovered all the harbors now named for him.",http://parks.state.wa.us/515/Grayland-Beach,Park Website,http://parks.state.wa.us/DocumentCenter/Home/View/1878,Park Map,,,"<Point><coordinates>-124.090636,46.78542,0.0</coordinates></Point>"
Griffin_Bay,Griffin Bay,campground,San Juan Islands Region,https://sites.google.com/site/virtualrangerproject/home/files/GriffinBay.jpg,"Griffin Bay State Park is a 15-acre marine park with 340 feet of shoreline. The park is part of the Cascadia Marine Trail and reachable only by human- and wind-powered watercraft. The park is a narrow band of land, which is bordered on both sides by private property.","Griffin Bay was the site of Old San Juan Town, a shanty town that grew up on the boundary of American Camp. The saloon was the primary attraction in town. When the county of San Juan was established, the county seat was placed in Friday Harbor. Now Griffin Bay is much quieter, remote from land traffic.",,Park Website,,Park Map,,,"<Point><coordinates>-123.00993,48.477514,0.0</coordinates></Point>"
Griffiths_Priday,Griffiths-Priday,sunny,Pacific Coast Region,https://sites.google.com/site/virtualrangerproject/home/files/Griffiths-Priday.jpg?attredirects=0,"Griffiths-Priday Ocean State Park is a 364-acre marine park with 8,316 feet of saltwater shoreline on the Pacific Ocean and 9,950 feet of freshwater shoreline on the Copalis River. The park extends from the beach through low dunes to the river, then north to the river's mouth. The Copalis Spit natural area, a designated wildlife refuge, is also part of the park.","The park owes its existence to Judge Griffiths, who in the late 1800s purchased the original 117 acres that he willed at his death to be made into a park for everyone's enjoyment. Griffiths stipulated that the park be named Griffiths-Priday Ocean State Park, a combination of his surname and the name of his foster parents who brought him to America from England as a child.",http://parks.state.wa.us/516/Griffith-Priday-Ocean,Park Website,http://parks.state.wa.us/DocumentCenter/Home/View/1879,Park Map,,,"<Point><coordinates>-124.181816,47.12562,0.0</coordinates></Point>"
Hope_Island__Mason,Hope Island (Mason),campground,South Puget Sound Region,https://sites.google.com/site/virtualrangerproject/home/files/HopeIsland_Mason.jpg,"Hope Island State Park is a 106-acre marine camping park on the western side of the state in Mason County, Puget Sound. This quiet island is reachable only by boat. Covered with old-growth forests and saltwater marshes, the park features a beach one-and-a-half miles long.",Hope Island was named by Commander Charles Wilkes for one of his crew in 1841. Wilkes was engaged in the mission of charting Puget Sound.,http://parks.state.wa.us/517/Hope-Island---Mason,Park Website,http://parks.state.wa.us/DocumentCenter/Home/View/1880,Park Map,,,"<Point><coordinates>-122.929366,47.18689,0.0</coordinates></Point>"
Hope_Island__Skagit,Hope Island (Skagit),campground,South Puget Sound Region,https://sites.google.com/site/virtualrangerproject/home/files/HopeIsland_Skagit.jpg,"Hope Island (north) State Park is a 200-acre marine park in Skagit Bay. The park offers several campsites, attractive beaches and a trail across the island. The island is forested with occasional meadows and rock outcroppings.",,http://parks.state.wa.us/518/Hope-Island---Skagit,Park Website,,Park Map,,,"<Point><coordinates>-122.566463,48.398721,0.0</coordinates></Point>"
Ike_Kinswa,Ike Kinswa,campground,Southwest Region,https://sites.google.com/site/virtualrangerproject/home/files/IkeKinswa.jpg,"Ike Kinswa State Park is a 454-acre camping park with 46,000 feet of freshwater shoreline on the north side of Mayfield Lake. The campsites are forested and available year-round.","The area around Ike Kinswa State Park was originally inhabited by the Cowlitz Indians. Their burial ground is located in the region. Many graves were relocated when the Mayfield Dam backed water up into the canyon. The area was originally named Mayfield Lake State Park, but the name was changed in 1971 to honor Ike Kinswa, a Cowlitz Indian who represented his people.",http://parks.state.wa.us/519/Ike-Kinswa,Park Website,http://parks.state.wa.us/DocumentCenter/Home/View/1881,Park Map,,,"<Point><coordinates>-122.526483,46.546111,0.0</coordinates></Point>"
Illahee,Illahee,campground,South Puget Sound Region,https://sites.google.com/site/virtualrangerproject/home/files/Illahee.jpg,"Illahee State Park is a 75-acre marine camping park with 1,785 feet of saltwater frontage on Port Orchard Bay. ""Illahee"" means ""earth"" or ""country"" in the Indian tradition, and views of Puget Sound from the Illahee beach give the viewer a sense of what that word meant to native people. The park has plenty of parking space, lots of fresh air, facilities for a number of outdoor activities and access to a variety of water sports.","Indian tradition states that the word ""Illahee"" means ""earth"" or ""country."" Illahee State Park was acquired in seven parcels between 1934 and 1954.",http://parks.state.wa.us/520/Illahee,Park Website,http://parks.state.wa.us/DocumentCenter/Home/View/1882,Park Map,,,"<Point><coordinates>-122.597049,47.597782,0.0</coordinates></Point>"
Iron_Horse,Iron Horse,sunny,Seattle-Tacoma Region,https://sites.google.com/site/virtualrangerproject/home/files/IronHorse.jpg,"Iron Horse State Park is a 1,612-acre park that was once part of the path of the Chicago-Milwaukee-St. Paul-Pacific Railroad. More than 100 miles of trail extends from Cedar Falls to the Columbia River. High trestles provide spectacular views of the valley below.","Originally, the trail right-of-way was part of the Chicago, Milwaukee, St. Paul and Pacific Railroad. The railroad operated between 1908 and 1980, when the company went into bankruptcy. The state's Department of Natural Resources acquired much of the property and turned it over to State Parks, which continues to acquire land and make improvements to the area.",http://parks.state.wa.us/521/Iron-Horse,Park Website,http://parks.state.wa.us/DocumentCenter/Home/View/1883,Park Map,,,"<Point><coordinates>-121.749181,47.434169,0.0</coordinates></Point>"
James_Island,James Island,campground,San Juan Islands Region,https://sites.google.com/site/virtualrangerproject/home/files/JamesIsland.jpg,"James Island State Park is a 113-acre marine camping and moorage park with 12, 335 feet of saltwater shoreline on Rosario Strait. The park features a beautiful western view of the San Juan islands from a high bluff along the loop trail.","The Wilkes Expedition named the island in 1841 to honor the earlier heroism of an American sailor, Reuben James. The federal government acquired the island and transferred it to the Washington State Parks and Recreation Commission in 1964.",http://parks.state.wa.us/522/James-Island,Park Website,,Park Map,,,"<Point><coordinates>-122.774977,48.512125,0.0</coordinates></Point>"
Jarrell_Cove,Jarrell Cove,campground,South Puget Sound Region,https://sites.google.com/site/virtualrangerproject/home/files/JarrellCove.jpg,"Jarrell Cove State Park is a 43-acre marine camping park with 3,500 feet of saltwater shoreline on the northwest end of Harstine Island in south Puget Sound. The forested island park is accessible by road and bridge and is off the beaten path. Most visitors arrive by boat. The park has campsites near the docks, as well as on rolling, grassy areas. Jarrell Cove State Park administers five other satellite parks including: Harstine Island, McMicken Island, Stretch Point, Eagle Island and Hope Island State Parks. Harstine Island State Park is a day use park with beach access via a half-mile trail. It is a two mile drive from Jarrell Cove. The other satellite parks are all accessible by boat only and offer buoys for moorage.","The park is named after Mrs. Philura Jarrel, the first pioneer woman to settle on the island. Jarrell Cove was acquired in four parcels between 1953 and 1969.",http://parks.state.wa.us/523/Jarrell-Cove,Park Website,http://parks.state.wa.us/DocumentCenter/Home/View/1885,Park Map,,,"<Point><coordinates>-122.883348,47.2832,0.0</coordinates></Point>"
Joemma_Beach,Joemma Beach,campground,South Puget Sound Region,https://sites.google.com/site/virtualrangerproject/home/files/JoemmaBeach.jpg,"Joemma Beach State Park is a 122-acre marine camping park with 3,000 feet of saltwater frontage on southeast Key Peninsula. Aside from the natural beauty of park and surroundings, the area is an excellent place for fishing, boating and crabbing.","This property was granted to Washington at statehood in 1889 for the support of common schools. The original recreation site was developed beginning in 1961 and was named Robert F. Kennedy Recreation Area on opening day in 1968. The property was transferred to State Parks in 1995 and was renamed ""Joemma Beach State Park"" after Joe and Emma Smith who lived on the premises from 1917 to 1932.",http://parks.state.wa.us/524/Joemma-Beach,Park Website,http://parks.state.wa.us/DocumentCenter/Home/View/1886,Park Map,,,"<Point><coordinates>-122.804074,47.226357,0.0</coordinates></Point>"
Jones_Island,Jones Island,campground,San Juan Islands Region,https://sites.google.com/site/virtualrangerproject/home/files/JonesIsland.jpg,"Jones Island State park is a 188-acre marine camping park with 25,000 feet of saltwater shoreline on the San Jaun channel. The park features a beautiful loop trail down the center of the island then around the western shore.","Jones Island was named by the Wilkes Expedition in 1841 in honor of Captain Jacob Jones, U.S. Navy. Jones, while master commandant of the sloop-of-war Wasp, captured the British brig Frolic on Oct. 18, 1812. The park was acquired from the U.S. Fish and Wildlife Service in 1983.",http://parks.state.wa.us/525/Jones-Island,Park Website,,Park Map,,,"<Point><coordinates>-123.046365,48.61553,0.0</coordinates></Point>"
Joseph_Whidbey,Joseph Whidbey,sunny,North West Region,https://sites.google.com/site/virtualrangerproject/home/files/JosephWhidbey.jpg,"Joseph Whidbey State Park is a 112-acre day-use park with 3,100 feet of saltwater shoreline on the Strait of Juan De Fuca in northern Puget Sound. The scenery is beautiful, views are magnificent, wildlife is everywhere and the beach is one of the grandest on Whidbey Island.","The park and other island features were named during the Vancouver Expedition of 1792. Master Joseph Whidbey circumnavigated the island, and Vancouver named it in his honor.",http://parks.state.wa.us/526/Joseph-Whidbey,Park Website,http://parks.state.wa.us/DocumentCenter/Home/View/1887,Park Map,,,"<Point><coordinates>-122.70754,48.3108,0.0</coordinates></Point>"
