ParkID,Name,Icon,Region,Thumbnail,Text1,Text2,ParkUrl,ParkUrlText,MapUrl,MapUrlText,TourUrl,TourUrlText,Location
Kanaskat_Palmer,Kanaskat-Palmer,campground,Seattle-Tacoma Region,https://sites.google.com/site/virtualrangerproject/home/files/Kanaskat-Palmer.jpg,"Kanaskat-Palmer State Park is a 320-acre camping park on a small, low plateau in a natural forest setting. The park has two miles of shorelines on the Green River. Boat and raft launching is by hand only. River rafting and kayaking down the Green River Gorge is for expert-level enthusiasts only. Shoreline activities include nature appreciation, trout fishing and picnicking.","The area around Kanaskat-Palmer and the Green River Gorge is abundant with mining history. The area is still mined for coal, as it has been for many years. Nearby Flaming Geyser gets its methane flame from a coal seam. Also mined locally was cinnabar, the base ore for mercury.",http://parks.state.wa.us/527/Kanaskat-Palmer,Park Website,http://parks.state.wa.us/DocumentCenter/Home/View/1888,Park Map,,,"<Point><coordinates>-121.890928,47.316389,0.0</coordinates></Point>"
Kinney_Point,Kinney Point,campground,North Puget Sound Region,https://sites.google.com/site/virtualrangerproject/home/files/KinneyPoint.jpg,Kinney Point is a 76-acre park situated on the south end of Marrowstone Island. The park features 683 feet of saltwater shoreline on Admiralty Inlet and Oak Bay. It is reachable by beachable boats only.,,http://parks.state.wa.us/528/Kinney-Point,Park Website,http://parks.state.wa.us/DocumentCenter/Home/View/1889,Park Map,,,"<Point><coordinates>-122.687129,48.008757,0.0</coordinates></Point>"
Kitsap_Memorial,Kitsap Memorial,campground,North Puget Sound Region,https://sites.google.com/site/virtualrangerproject/home/files/KitsapMemorial.jpg,"Kitsap Memorial State Park is a 58-acre camping park with 1,797 feet of saltwater shoreline and facilities for group and individual recreation, weddings and overnight stays. The park offers beautiful natural surroundings and sweeping views of Hood Canal.","Kitsap County requested the inclusion of ""memorial"" in the park's name at the time of original land donation from the county. The name reflects the wishes and efforts of the original members of the Vinland Community Club, who sought to establish a ""North Kitsap Memorial Park"" in honor of Henry Brown. Mr. Brown was the person who first proposed dedicating the land for community use. He also established the first permanent buildings on the site.",http://parks.state.wa.us/529/Kitsap-Memorial,Park Website,http://parks.state.wa.us/DocumentCenter/Home/View/1890,Park Map,,,"<Point><coordinates>-122.651047,47.817501,0.0</coordinates></Point>"
Kopachuck,Kopachuck,campground,Seattle-Tacoma Region,https://sites.google.com/site/virtualrangerproject/home/files/Kopachuck.jpg,"Kopachuck State Park is a 109-acre marine and camping park with 5,600 feet of saltwater shoreline on Henderson Bay. One portion of the park, Cutts Island (or ""Deadman's Island"") is a half mile from shore and reachable only by boat. The park provides scenic views of sunsets, the Olympic Mountains and Puget Sound.","The name ""Kopachuck"" originated from ""Chinook Jargon,"" the trade language of the Pacific Coastal Indians. Kopachuck is a merging of two words: ""Kopa"" meaning ""at,"" and ""chuck"" meaning ""water."" This scenic park was once a seasonal fishing and clamming site of the Puyallup and Nisqually tribes.",http://parks.state.wa.us/530/Kopachuck,Park Website,http://parks.state.wa.us/DocumentCenter/Home/View/1891,Park Map,,,"<Point><coordinates>-122.682345,47.310617,0.0</coordinates></Point>"
Lake_Chelan,Lake Chelan,campground,North Central Region,https://sites.google.com/site/virtualrangerproject/home/files/LakeChelan.jpg,"Lake Chelan State Park is a 127-acre camping park on the forested south shore of Lake Chelan. The park has 6,000 feet of shoreline, lakeside views and expansive lawns for strolling and playing. The park gets an annual average rainfall of 11 inches. Summer tends to be hot and dry. Annual average snowfall is 42 inches.","Native Americans used this site as a home and hunting area for many years. The name ""Chelan"" is a Salish Indian word meaning both ""lake"" and ""blue water.""",http://parks.state.wa.us/531/Lake-Chelan,Park Website,http://parks.state.wa.us/DocumentCenter/Home/View/1892,Park Map,,,"<Point><coordinates>-120.200034,47.873883,0.0</coordinates></Point>"
Lake_Easton,Lake Easton,campground,Seattle-Tacoma Region,https://sites.google.com/site/virtualrangerproject/home/files/LakeEaston.jpg,"Lake Easton State Park is a forested, 516-acre year-round camping park with 24,000 feet of freshwater access on the shores of Lake Easton in the Cascade Mountain foothills. The park has beautiful mountain views and hiking trails to explore in the summer and cross country and snowmobiling trails to enjoy in the winter. The park's location also allows for snowy winter-sport opportunities.",The park is located within a glacial valley in the Washington Cascade Range. The Northern Pacific Railroad built a tunnel through the Cascades beginning at Easton.,http://parks.state.wa.us/532/Lake-Easton,Park Website,http://parks.state.wa.us/DocumentCenter/Home/View/1893,Park Map,,,"<Point><coordinates>-121.197151,47.249248,0.0</coordinates></Point>"
Lake_Sammamish,Lake Sammamish,sunny,Seattle-Tacoma Region,https://sites.google.com/site/virtualrangerproject/home/files/LakeSammamish.jpg,"Lake Sammamish State Park is a 512-acre day-use park with 6,858 feet of waterfront on Lake Sammamish. The area around the lake was an important culture zone for local Native American tribes for centuries. The park provides deciduous forest and wetland vegetation for the enjoyment of visitors. A salmon-bearing creek and a great-blue-heron rookery are additional features.","The Lake Sammamish area was once a gathering place for Indian tribes. They celebrated their ""potlatch,"" or winter festival, at the south end of the lake, where they hunted, fished and berry-gathered in preparation for winter. The word ""Sammamish"" comes from the Indian ""Samena,"" meaning ""hunter.""",http://parks.state.wa.us/533/Lake-Sammamish,Park Website,http://parks.state.wa.us/DocumentCenter/Home/View/1894,Park Map,,,"<Point><coordinates>-122.061324,47.556227,0.0</coordinates></Point>"
Lake_Sylvia,Lake Sylvia,campground,Southwest Region,https://sites.google.com/site/virtualrangerproject/home/files/LakeSylvia.jpg,"Lake Sylvia State Park is a quiet, 233-acre camping park with 15,000 feet of freshwater shoreline. The park is an old logging camp in a wooded area halfway between Olympia and the Pacific shore. Aside from the interesting displays of old logging gear and curiosities, the lake is good for fishing, and the rustic charm of the park makes for excellent day outings and group camping trips.","Huge, old-growth stumps are everywhere in the park. There is a giant wooden ball carved from a single log by a local logging legend. Story has it the logger could stand atop the floating ball and ""walk it"" from one end of the lake to the other. The area is rich with logging lore and history. When logging ceased in 1930, the dam was used to generate electricity for the town of Montesano.",http://parks.state.wa.us/534/Lake-Sylvia,Park Website,http://parks.state.wa.us/DocumentCenter/Home/View/1895,Park Map,,,"<Point><coordinates>-123.590533,47.000211,0.0</coordinates></Point>"
Lake_Wenatchee,Lake Wenatchee,campground,North Central Region,https://sites.google.com/site/virtualrangerproject/home/files/LakeWenatchee.jpg,"Lake Wenatchee State Park is a 489-acre camping park with 12,623 feet of waterfront on glacier-fed Lake Wenatchee and the Wenatchee River. The park is bisected by the Wenatchee River, creating two distinct areas _�_ south park, which features areas for camping, swimming and horseback riding, and north park, which is in a less developed, forested section of the park and a quarter-mile walk from the lake. The park is a natural wildlife area, and visitors should be aware of the presence of bears and other natural dangers.","During their annual migration long ago, Native American tribes stopped at Lake Wenatchee for a feast of clams and salmon before heading west to trade with coastal tribes.",http://parks.state.wa.us/535/Lake-Wenatchee,Park Website,http://parks.state.wa.us/DocumentCenter/Home/View/1896,Park Map,,,"<Point><coordinates>-120.720004,47.808299,0.0</coordinates></Point>"
Larrabee,Larrabee,campground,North West Region,https://sites.google.com/site/virtualrangerproject/home/files/Larrabee.jpg,"Larrabee State Park is a 2,683-acre camping park with 8,100 feet of saltwater shoreline on Samish Bay near Bellingham in northwest Washington. The park features two freshwater lakes, coves and tidelands. Sunsets are gorgeous. A variety of non-motorized, multiple-use trails wind through the park.","In October 1915, the Larrabee family donated 20 acres of land to the state to be made into a park. Officially named in honor of Charles Xavier Larrabee in 1923, the area became Washington's first state park.",http://parks.state.wa.us/536/Larrabee,Park Website,http://parks.state.wa.us/DocumentCenter/Home/View/1898,Park Map,,,"<Point><coordinates>-122.490618,48.651234,0.0</coordinates></Point>"
Leadbetter_Point,Leadbetter Point,sunny,Pacific Coast Region,https://sites.google.com/site/virtualrangerproject/home/files/LeadbetterPoint.jpg,"Leadbetter Point State Park is a natural area open for day use. The park features beach frontage on the Pacific Ocean and Willapa Bay. It borders the Willapa National Wildlife Refuge which has about five miles of ocean beach and several miles of bay beach. There are views of the Pacific Ocean to the west and Willapa Bay and hills to the east. The park is part of the Willapa Bay Water Trail. Visitors can enjoy hiking, fishing and clamming at the park.",,http://parks.state.wa.us/537/Leadbetter-Point,Park Website,http://parks.state.wa.us/DocumentCenter/Home/View/1899,Park Map,,,"<Point><coordinates>-124.051211,46.596392,0.0</coordinates></Point>"
Lewis_Clark,Lewis & Clark,campground,Pacific Coast Region,https://sites.google.com/site/virtualrangerproject/home/files/Lewis_Clark.jpg,"Lewis and Clark State Park is a 621-acre camping park situated in one of the last major stands of old-growth forest in the state. Coniferous trees, streams, wetlands, dense vegetation and wet prairie comprise the park environment.","Lewis and Clark State Park, which is actually separate from the Lewis and Clark Trail, began as a ""public camp"" for automobile tourists in 1922. Two years later, more than 10,000 people visited the park annually. The old north spur of the Oregon Trail, which extended from the Cowlitz River landing to the city of Tumwater, passed directly through the present park site.",http://parks.state.wa.us/538/Lewis-Clark,Park Website,http://parks.state.wa.us/DocumentCenter/Home/View/1900,Park Map,,,"<Point><coordinates>-122.819143,46.519655,0.0</coordinates></Point>"
Lewis_Clark_Trail,Lewis & Clark Trail,campground,Pacific Coast Region,https://sites.google.com/site/virtualrangerproject/home/files/LewisClarkTrail.jpg,"Lewis and Clark Trail State Park is a 37-acre camping park with 1,333 feet of freshwater shoreline on the Touchet River. The park is a rare treasure of old-growth forest and river in the midst of the surrounding arid grassland.",The park is located on the historic Nimipooiskit trail that extends from the Rocky Mountains to the Pacific Ocean. Remnants of the trail can be observed near the park.,http://parks.state.wa.us/539/Lewis-Clark-Trail,Park Website,http://parks.state.wa.us/DocumentCenter/Home/View/1901,Park Map,,,"<Point><coordinates>-118.07228,46.288328,0.0</coordinates></Point>"
Lime_Kiln_Point,Lime Kiln Point,sunny,San Juan Islands Region,https://sites.google.com/site/virtualrangerproject/home/files/LimeKilnPoint.jpg,"Lime Kiln Point is a 36-acre day-use park set on the west side of San Juan Island. The park is considered one of the best places in the world to view whales from a land-based facility. Orca whales are common in the waters off Lime Kiln. The park, which features a richly diverse environment, includes the remnants and landscapes of a history filled with change, along the rocky shoreline and through the wooded uplands.","In 1860, a lime producing operation began to operate in what is now part of the park. For 60 years, the area adjacent to the park was quarried for limestone. Kilns were built to fire the limestone to produce lime. Buildings were built, roads were cut and much of the island was logged to feed the fires of the kilns. The U.S. Coast Guard operated the area adjacent to the lime operation as a lighthouse preserve.",http://parks.state.wa.us/540/Lime-Kiln-Point,Park Website,http://parks.state.wa.us/DocumentCenter/Home/View/1902,Park Map,,,"<Point><coordinates>-123.150155,48.51622,0.0</coordinates></Point>"
Lincoln_Rock,Lincoln Rock,campground,North Central Region,https://sites.google.com/site/virtualrangerproject/home/files/LincolnRock.jpg,"Lincoln Rock State Park is an 80-acre camping park on the east side of Lake Entiat, created by Rocky Reach Dam blocking the flow of the Columbia River north of Wenatchee. The park, a popular place for swimming, water-skiing and respite from the hot sun, was named for a basalt outcropping said to resemble the profile of Abraham Lincoln.","Lincoln Rock was named after a prominent geological feature, visible across the river, which resembles the profile of Abraham Lincoln.",http://parks.state.wa.us/541/Lincoln-Rock,Park Website,http://parks.state.wa.us/DocumentCenter/Home/View/1903,Park Map,,,"<Point><coordinates>-120.284621,47.538287,0.0</coordinates></Point>"
Manchester,Manchester,campground,South Puget Sound Region,https://sites.google.com/site/virtualrangerproject/home/files/Manchester.jpg,"Manchester State Park is a 111-acre camping park with 3,400 feet of saltwater shoreline on Rich Passage in Puget Sound. The park is covered in woods of fir and maple.","The park was constructed at the turn of the century as a U.S. Coast Artillery harbor defense installation for the protection of Bremerton. During World War II, the property was converted to a navy fuel supply depot and a navy fire-fighting station.",http://parks.state.wa.us/542/Manchester,Park Website,http://parks.state.wa.us/DocumentCenter/Home/View/1905,Park Map,,,"<Point><coordinates>-122.550349,47.575652,0.0</coordinates></Point>"
Maryhill,Maryhill,campground,Columbia Gorge Region,https://sites.google.com/site/virtualrangerproject/home/files/Maryhill.jpg,"Maryhill State Park is a 99-acre camping park with 4,700 feet of waterfront on the Columbia River in Klickitat County. The area is significant for its natural beauty, its access to the surrounding natural wonders and its cultural history. A full-scale model of Stonehenge stands near the park.","Maryhill State Park was acquired by lease from the U.S. Army Corps of Engineers in 1972 at no cost. Sam Hill, considered a local eccentric, built a ""castle"" for his daughter, Mary, on a hill, and named it ""Maryhill."" He designated the beautiful building, originally designed as a family home, as an art museum before the end of its construction.",http://parks.state.wa.us/543/Maryhill,Park Website,http://parks.state.wa.us/DocumentCenter/Home/View/1906,Park Map,,,"<Point><coordinates>-120.836876,45.681317,0.0</coordinates></Point>"
Matia_Island,Matia Island,campground,San Juan Islands Region,https://sites.google.com/site/virtualrangerproject/home/files/MatiaIsland.jpg,"Matia Island State Park is a 145-acre marine park with 20,676 feet of saltwater shoreline on the Strait of Georgia. The island is part of the San Juan National Wildlife Refuge. Under a mutual agreement between the U.S. Fish and Wildlife Service and the Washington State Parks and Recreation Commission, five acres at Rolfe Cove are available to boaters as a marine park.","Captain Eliza of the 1792 Spanish Expedition named the island ""Isle de Mata."" Mata has many meanings in Spanish, most having to do with lush plant growth. Some believe Matia refers to a woman's name. The U.S. Coast Survey conffered the name Matia in 1954.",http://parks.state.wa.us/544/Matia-Island,Park Website,,Park Map,,,"<Point><coordinates>-122.837028,48.746443,0.0</coordinates></Point>"
McMicken_Island,McMicken Island,sunny,South Puget Sound Region,https://sites.google.com/site/virtualrangerproject/home/files/McMickenIsland.jpg,"McMicken Island State Park is an 11.5 acre marine park with 1,661 feet of saltwater shoreline. It is situated in the beautiful South Puget Sound and features a pristine cove to set anchor. Visitors can enjoy the many hiking trails, viewing an active bald eagle nest and shellfish harvesting. The shellfish population is abundant and open to shellfish harvesters year round.","Originally, a Swedish sailor jumped ship and settled on the island, naming the island after himself, Lundquist. However, when Mr. Lundquist attempted a legal claim on the island with the U.S. government, he was told they had no record of its existence. A surveyor was sent to record the island on U.S. maps and then gave the island his name, McMicken.",http://parks.state.wa.us/545/McMicken-Island,Park Website,,Park Map,,,"<Point><coordinates>-122.932492,47.186197,0.0</coordinates></Point>"
Millersylvania,Millersylvania,campground,Southwest Region,https://sites.google.com/site/virtualrangerproject/home/files/Millersylvania.jpg,"Millersylvania State Park is an 842-acre camping park with 3,300 feet of freshwater shoreline on Deep Lake. The park, filled with trails, is abundant in old-growth cedar and fir trees. Millersylvania was constructed almost entirely by hand in 1935 by the Civilian Conservation Corps.","Millersylvania's buildings were constructed in 1935 almost entirely by hand by the Civilian Conservation Corps. Relics of a narrow-gauge railroad, and several skid roads used in the 1800s by the logging industry, remain on park grounds. Stumps of trees still carry notch scars where springboards supported brawny loggers.",http://parks.state.wa.us/546/Millersylvania,Park Website,http://parks.state.wa.us/DocumentCenter/Home/View/1909,Park Map,,,"<Point><coordinates>-122.912661,46.914865,0.0</coordinates></Point>"
Moran,Moran,campground,San Juan Islands Region,https://sites.google.com/site/virtualrangerproject/home/files/Moran.jpg,"Moran State Park is a 5,252-acre camping park with five freshwater lakes and over 30 miles of hiking trails. Atop the 2,409-foot-high Mt. Constitution, the highest point on the San Juan Islands, there stands a stone observation tower built by the Civilian Conservation Corps in 1936. The tower offers panoramic views of the surrounding islands, the Cascade Mountains and a variety of Canadian and American cities.","Moran State Park opened in 1921 when Robert Moran, shipbuilder and former mayor of Seattle, donated more than 2,700 acres to the state for a park. Most of the trails, roads, bridges, and buildings in the park were built by the Civilian Conservation Corps (CCC) during the 1930s. The builders used native materials on site to construct the many stone and wooden shelters and buildings.",http://parks.state.wa.us/547/Moran,Park Website,http://parks.state.wa.us/DocumentCenter/Home/View/1910,Park Map,,,"<Point><coordinates>-122.826433,48.664217,0.0</coordinates></Point>"
Mount_Pilchuck,Mount Pilchuck,sunny,North West Region,https://sites.google.com/site/virtualrangerproject/home/files/MountPilchuck.jpg,"Mount Pilchuck State Park is a 1,893-acre day-use park that features mountainous alpine terrain with diverse scenic and recreation attractions.","The main recreational attraction of the park is the three-mile trail to the summit and the old fire lookout. The trail begins at 3100 feet above sea level and winds through an old growth forest to alpine heather and large rocks at the summit of Mount Pilchuck (5324 feet above sea level). The hike is strenuous and in the summer can be very crowded. At the top is an incredible panoramic view of the Cascades, Olympics and Puget Sound. The trail is usually covered with snow until midsummer.",http://parks.state.wa.us/548/Mount-Pilchuck,Park Website,http://parks.state.wa.us/DocumentCenter/Home/View/1911,Park Map,,,"<Point><coordinates>-121.772955,48.060314,0.0</coordinates></Point>"
Mount_Spokane,Mount Spokane,campground,Northeast Region,https://sites.google.com/site/virtualrangerproject/home/files/MountSpokane.jpg,"Mount Spokane State Park is a 13,919-acre camping park in the Selkirk Mountains. The view at the top of the 5,883-foot elevation includes surrounding states and Canada. The forested park features stands of old-growth timber and granite rock outcroppings. In winter, the park receives 300 inches of snow.","The area was the first state park east of the Cascades, and the Civilian Conservation Corps accomplished the initial development. The mountain has been a popular ski area since 1950.",http://parks.state.wa.us/549/Mount-Spokane,Park Website,http://parks.state.wa.us/DocumentCenter/Home/View/1912,Park Map,,,"<Point><coordinates>-117.110888,47.917797,0.0</coordinates></Point>"
Mystery_Bay,Mystery Bay,sunny,North Puget Sound Region,https://sites.google.com/site/virtualrangerproject/home/files/MysteryBay.jpg,This 10-acre marine park is reachable by car or boat. The park features 685 feet of saltwater shoreline on Mystery Bay and offers a spectacular view of the Olympic Mountains.,"The name ""Mystery Bay"" derives from smuggling activity on the island during Prohibition days. Transporting booze from Canada was a profitable and somewhat honored occupation in the remote waters of northwest Washington. Sequestered between Marrowstone and Indian Islands, Kilisut Harbor was one refuge used by smugglers to evade Coast Guard vessels.",http://parks.state.wa.us/550/Mystery-Bay,Park Website,http://parks.state.wa.us/DocumentCenter/Home/View/1913,Park Map,,,"<Point><coordinates>-122.697254,48.059932,0.0</coordinates></Point>"
Nine_Mile,Nine Mile,campground,Northeast Region,https://sites.google.com/site/virtualrangerproject/home/files/RiverSide.jpg,"Nine Mile Recreation Area is available for camping, picnicking, swimming, fishing and boating.","The Spokane House Interpretive Center at Nine Mile Falls tells the history of the early fur trade in the area and its effects on the Native American population. The center is open Saturdays and Sundays 10 a.m. - 4 p.m., Memorial Day through Labor Day.",http://parks.state.wa.us/573/Riverside,Park Website,http://parks.state.wa.us/DocumentCenter/Home/View/1935,Park Map,,,"<Point><coordinates>-117.527543,47.776257,0.0</coordinates></Point>"
Nolte,Nolte,sunny,Seattle-Tacoma Region,https://sites.google.com/site/virtualrangerproject/home/files/Nolte.jpg,"Nolte State Park is a 117-acre day-use park with 7,174 feet of freshwater shoreline on Deep Lake in the Green River Gorge. Covered with forests and blessed with water, the land was a resort for many years before it was donated to State Parks.","Formerly a vacation resort known as Deep Lake Park and owned by the Nolte family, the area was donated in the early 1970s to the state of Washington by Minnie Nolte, for whom the park is named.",http://parks.state.wa.us/552/Nolte,Park Website,http://parks.state.wa.us/DocumentCenter/Home/View/1914,Park Map,,,"<Point><coordinates>-121.940578,47.266878,0.0</coordinates></Point>"
Ocean_City,Ocean City,campground,Pacific Coast Region,https://sites.google.com/site/virtualrangerproject/home/files/OceanCity.jpg,"Ocean City State Park is a year-round, 170-acre camping park, featuring ocean beach, dunes and dense thickets of shore pine. Migratory birds may be viewed at the park, and beachcombing is a popular activity.","Native Americans traveled over the flat and wide beach and early settlers carried supplies from Aberdeen to Minard's Landing by crossing the peninsula to Oyhut, traveling north on the beach. Although necessary for survival back then, fishing and clamming are now recreational pasttimes at the park.",http://parks.state.wa.us/554/Ocean-City,Park Website,http://parks.state.wa.us/DocumentCenter/Home/View/1916,Park Map,,,"<Point><coordinates>-124.164208,47.033178,0.0</coordinates></Point>"
Olallie,Olallie,sunny,Seattle-Tacoma Region,https://sites.google.com/site/virtualrangerproject/home/files/Olallie.jpg,"Olallie State Park is a 2,500- acre day use park on the western slopes of the Cascade Mountains featuring dramatic waterfalls, cliff formations and old-growth trees over 10 feet in diameter. The park is a popular location for hiking, picnicking, fishing and rock climbing. The park's popular hiking destinations include Twin Falls, Weeks Falls, Cedar Butte and Mount Washington.","""Olallie"" is the Chinook Jargon word for ""berry."" The park is rich in huckleberries.",http://parks.state.wa.us/555/Olallie,Park Website,http://parks.state.wa.us/DocumentCenter/Home/View/1917,Park Map,,,"<Point><coordinates>-121.657362,47.435838,0.0</coordinates></Point>"
